{
  "id": "openpcb.core.ic.ams1117-3v3-sot-223",
  "uuid": "8baba776-a706-5d9b-bf65-bbf3a79792c7",
  "version": "1.0.0",
  "name": "AMS1117-3.3 SOT-223",
  "description": "AMS1117 fixed 3.3 V linear regulator in SOT-223 package.",
  "category": "ic",
  "tags": [
    "ic",
    "regulator",
    "ldo",
    "3.3v",
    "sot-223",
    "kicad-derived"
  ],
  "aliases": [],
  "symbol": "openpcb.core.symbol.ic.ams1117-3v3",
  "defaultFootprint": "openpcb.core.footprint.package.sot-223",
  "footprints": [
    {
      "footprint": "openpcb.core.footprint.package.sot-223",
      "label": "SOT-223",
      "pinMap": [
        {
          "pinNumber": "1",
          "padNumber": "1",
          "pinName": "GND"
        },
        {
          "pinNumber": "2",
          "padNumber": "2",
          "pinName": "VO"
        },
        {
          "pinNumber": "3",
          "padNumber": "3",
          "pinName": "VI"
        },
        {
          "pinNumber": "2",
          "padNumber": "4",
          "pinName": "VO"
        }
      ]
    }
  ],
  "provenance": {
    "source": "kicad-derived",
    "license": "CC-BY-SA-4.0+KiCad-Libraries-Exception",
    "attribution": [
      "Derived from KiCad official libraries."
    ],
    "sourceFormat": "openpcb-component",
    "sourceFileName": "AMS1117-3.3.kicad_sym",
    "sourceLibrary": "Regulator_Linear",
    "sourceItemName": "AMS1117-3.3 SOT-223",
    "sourceHash": "f6951caf7f7bbfa07f735ac009549a4cbde8b5dd4a0c7c9f4e2400a02a369759",
    "upstreamUrl": "https://gitlab.com/kicad/libraries",
    "convertedAt": "2026-05-21T00:00:00.000Z",
    "conversionTool": "CoreLibrary tools/import-kicad-batch.ts"
  },
  "compatibility": {
    "minOpenPcbVersion": "0.1.0"
  }
}
